customer_id,date_of_order,age_group,state,city,pincode,items_purchased_count,items_list,repeat_order,order_value,discount_value,payment_mode,product_category,prime_member_flag,delivery_speed
AMZ000001,2025-08-02 22:02:55,45-54,Gujarat,Ahmedabad,974660,5,"Lenovo Power Bank Mini 1TB, Dell Laptop 2025 Edition 8GB RAM, Havells Washing Machine Pro 512GB, Sony Camera 2025 Edition 8GB RAM, Canon Laptop With Warranty 512GB",Yes,9652,1240,UPI,Home,No,Same-day
AMZ000002,2025-10-20 09:42:02,45-54,Delhi,New Delhi,226691,2,"Havells Water Purifier Max 6GB RAM, Sony Smartphone Max 16GB RAM",Yes,7495,885,Cash on Delivery,Electronics,No,Fast
AMZ000003,2025-06-12 17:48:06,55+,Uttar Pradesh,Kanpur,388007,6,"Prestige Water Purifier 2025 Edition 16GB RAM, Apple Air Fryer Mini 8GB RAM, Logitech Mixer Grinder 2024 Model, Realme LED Bulb Bundle 128GB, Apple Smartphone Mini 8GB RAM, Boat Water Purifier Bundle 128GB",Yes,3110,1259,Wallet,Books,No,Fast
AMZ000004,2025-06-17 16:25:20,18-24,Telangana,Warangal,555305,4,"Prestige Smartphone Standard 4GB RAM, Lenovo Power Bank Mini 1TB, Honor Cookware Set Max 4GB RAM, Canon Smartphone With Warranty 4GB RAM",No,9744,815,Wallet,Books,Yes,Same-day
AMZ000005,2024-07-10 02:38:35,18-24,Gujarat,Ahmedabad,925447,3,"Apple Water Purifier Pro 256GB, Honor Refrigerator Max 128GB, Usha Bluetooth Speaker 2025 Edition 64GB",No,8353,856,Wallet,Beauty,Yes,Standard
